{"$schema":"https://json-schema.org/draft/2020-12/schema","title":"JiuwenSwarm v4 plan","type":"object","required":["research_question","hypothesis","variables","experiment_plan","success_criteria","expected_evidence","human_confirmation_items"],"properties":{"research_question":{"type":"string"},"hypothesis":{"type":"string"},"variables":{"type":"array","items":{"type":"string"}},"experiment_plan":{"type":"array","items":{"type":"string"}},"success_criteria":{"type":"array","items":{"type":"string"}},"expected_evidence":{"type":"array","items":{"type":"string"}},"human_confirmation_items":{"type":"array","items":{"type":"string"}}},"additionalProperties":false}