{
  "research_question": "带证据的反思循环能否避免把未执行任务写成已完成？",
  "hypothesis": "证据检查可能改善审计表达，但当前基准不证明真实自我进化。",
  "variables": [
    "反思循环类型（无护栏/仅提示/完整护栏）",
    "任务执行状态（supported/unexecuted/indeterminate）",
    "UCR（未执行任务被写成已完成的比例）",
    "任务成功率",
    "护栏启用与接受状态"
  ],
  "experiment_plan": [
    "在相同任务集上运行三个实验臂：no-rail、prompt-only、full-rail。",
    "对每个操作记录证据匹配结果，并标注supported、unexecuted或indeterminate。",
    "计算UCR为unexecuted决策数除以总决策数，仅作为过程证据指标。",
    "比较各臂UCR与任务成功率，检查证据检查是否降低未执行任务被写成已完成的情况。",
    "不将结果外推为真实自我进化，仅报告审计表达差异。"
  ],
  "success_criteria": [
    "每个结论均可追溯到具体实验臂的决策记录。",
    "UCR仅作为过程证据指标报告，不解释为能力或进化证据。",
    "任务成功率与UCR分开报告，避免混淆。",
    "若证据不足，明确标注indeterminate或not_measured。"
  ],
  "expected_evidence": [
    "no-rail臂UCR=0.5556（5/9），其中5个unexecuted、4个supported。",
    "prompt-only臂UCR=0.0（0/4），4个supported、0个unexecuted。",
    "full-rail臂UCR=0.0（0/4），4个supported、0个unexecuted，护栏启用1次且被接受。",
    "三臂任务成功率均为1.0。",
    "CFR与NFR在UCR场景中未测量。"
  ],
  "human_confirmation_items": [
    "确认UCR是否仅作为过程证据指标，而非真实自我进化证据。",
    "确认citation_allowed=false的文献不得作为正式引用。",
    "确认是否需要补充CFR与NFR测量以支持更强结论。",
    "确认当前基准是否足以回答研究问题，或需扩展任务集。"
  ]
}
