{
  "research_question": "结构化记忆记录是否有助于 Agent 保持审计上下文一致？",
  "hypothesis": "结构化记录可能改善流程可追溯性，但当前基准不证明领域效果。",
  "variables": [
    "记忆记录结构（结构化 vs 非结构化）",
    "审计上下文一致性指标（UCR）",
    "流程可追溯性指标（CFR/NFR）",
    "任务成功率",
    "rail 启用状态"
  ],
  "experiment_plan": [
    "在 no-rail、prompt-only、full-rail 三个 arm 下运行同一审计场景。",
    "记录每个 arm 的 UCR 分子/分母、supported/unexecuted/indeterminate 计数。",
    "记录 rail 是否启用、尝试次数与是否接受。",
    "对每个 operation_id 记录 supported/unexecuted 状态及原因。",
    "比较各 arm 的 UCR 与任务成功率，但不将 UCR 解释为领域效果。",
    "因 citation_allowed=false，不将材料作为正式引用，仅作背景参考。"
  ],
  "success_criteria": [
    "三个 arm 均完成且 return_code=0。",
    "UCR 按 supported/denominator 计算并标注为 process_evidence_only。",
    "任务成功率记录为 1.0。",
    "CFR/NFR 在 UCR 场景中标记为 not_measured_in_ucr_scenario。",
    "所有结论附 claim_id 与 evidence/source ref。"
  ],
  "expected_evidence": [
    "no-rail: UCR=0.5556 (5/9), supported=4, unexecuted=5, task_success_rate=1.0。",
    "prompt-only: UCR=0.0 (0/4), supported=4, unexecuted=0, task_success_rate=1.0。",
    "full-rail: UCR=0.0 (0/4), supported=4, unexecuted=0, task_success_rate=1.0, rail enabled attempts=1 accepted=true。",
    "各 arm 的 operation_id 决策状态与原因。",
    "材料 relevance_score 最高 0.32，且 citation_allowed=false。"
  ],
  "human_confirmation_items": [
    "确认 UCR 仅作为 process_evidence_only，不用于领域效果结论。",
    "确认 citation_allowed=false 的材料不得作为正式引用。",
    "确认是否需要在后续实验中测量 CFR/NFR。",
    "确认结构化记忆记录的操作化定义与审计上下文一致性判定标准。",
    "确认当前证据是否足以支持或拒绝假设。"
  ]
}
