{
  "research_question": "程序级证据护栏能否提高 Agent 执行报告的证据一致性？",
  "hypothesis": "full-rail 应比无护栏或仅提示词减少无证据完成声明。",
  "variables": [
    "arm",
    "seed",
    "supported_claims",
    "blocked_claims"
  ],
  "experiment_plan": [
    "执行 UCR 三种 arm",
    "保存轨迹、Rail 事件、命令和哈希",
    "比较证据决策"
  ],
  "success_criteria": [
    "三种 arm 独立完成",
    "每个实验 claim 有 JSON Pointer",
    "失败不写成成功"
  ],
  "expected_evidence": [
    "experiment_results.json",
    "tool_trace.jsonl",
    "rail_events.jsonl",
    "claim_ledger.json"
  ],
  "human_confirmation_items": [
    "研究问题是否值得研究",
    "实验是否真实反映系统行为",
    "最终结论是否超过证据范围"
  ]
}
