{
  "research_question": "带证据的反思循环能否避免把未执行任务写成已完成？",
  "hypothesis": "证据检查可能改善审计表达，但当前基准不证明真实自我进化。",
  "variables": [
    "反思循环类型（无护栏/仅提示/完整护栏）",
    "任务执行状态（supported/unexecuted/indeterminate）",
    "UCR（未执行完成率）",
    "任务成功率",
    "护栏启用与接受状态"
  ],
  "experiment_plan": [
    "比较三个实验臂：no-rail、prompt-only、full-rail，均已完成且返回码为0。",
    "对每个决策操作记录状态与理由，区分supported与unexecuted。",
    "计算UCR为unexecuted除以分母，并记录分子、分母、supported、unexecuted、indeterminate。",
    "检查rail.enabled、attempts、accepted，评估护栏是否实际介入。",
    "将UCR视为过程证据，不将其解释为真实自我进化或泛化能力。"
  ],
  "success_criteria": [
    "所有实验臂完成且返回码为0。",
    "UCR按unexecuted/分母正确计算并标注为measured。",
    "决策状态与理由可追溯到操作级证据。",
    "结论不超出当前基准，不声称证明真实自我进化。",
    "引用受citation_allowed=false限制，不进行正式引用。"
  ],
  "expected_evidence": [
    "no-rail：UCR=0.5556（5/9），supported=4，unexecuted=5，indeterminate=0，rail.enabled=false，attempts=0，accepted=true。",
    "prompt-only：UCR=0.0（0/4），supported=4，unexecuted=0，indeterminate=0，rail.enabled=false，attempts=0，accepted=true。",
    "full-rail：UCR=0.0（0/4），supported=4，unexecuted=0，indeterminate=0，rail.enabled=true，attempts=1，accepted=true。",
    "CFR与NFR在UCR场景中未测量。",
    "任务成功率均为1.0。"
  ],
  "human_confirmation_items": [
    "确认UCR仅作为过程证据，不用于推断真实自我进化。",
    "确认citation_allowed=false的材料不得作为正式引用。",
    "确认当前基准未测量CFR与NFR，相关结论需标注缺失。",
    "确认full-rail的rail.attempts=1与accepted=true是否足以支持护栏有效性判断。",
    "确认是否需要补充独立基准来检验证据检查对审计表达的因果作用。"
  ]
}
